{
  "suiteVersion": "1.0.0",
  "specVersion": "0.1.0",
  "publishedAt": "2026-03-13T12:00:00Z",
  "implementations": [
    {
      "repo": "https://github.com/StevenBuglione/open-cli",
      "version": "main",
      "status": "partial",
      "features": {
        "httpCaching": "passing",
        "refresh": "passing",
        "observabilityHooks": "passing",
        "compatibilityMatrix": "passing",
        "mcpTransports": "partial",
        "oauthRuntime": "partial"
      },
      "notes": [
        "Reference implementation status after the native MCP + OAuth implementation pass.",
        "open-cli runtime verification is green, but oas-cli-conformance does not yet mechanically enforce those runtime checks."
      ]
    }
  ]
}
